{
  "$id": "https://github.com/kjanat/runner/blob/master/npm/targets.schema.json",
  "$schema": "https://json-schema.org/draft/2020-12/schema",
  "$defs": {
    "target": {
      "description": "Build target for a specific platform/configuration. \nUsed to generate release tarballs and platform-specific sub-packages.",
      "markdownDescription": "# Build target  \nBuild target for a specific platform/configuration.  \nUsed to generate release tarballs and platform-specific sub-packages.",
      "type": "object",
      "required": [
        "build",
        "cpu",
        "os",
        "pkg",
        "runner",
        "rust",
        "tier"
      ],
      "properties": {
        "build": {
          "description": "- \"cargo\" for native compilation on a matching runner; \n- \"cross\" for cross-compilation via the \"cross\" crate (typically Linux → { Linux, *BSD }); \n- \"cargo-cross-toolchain\" for stable cross-compilation via taiki-e/setup-cross-toolchain-action (Linux → tier-2 BSD/illumos/Android with prebuilt std); \n- \"cargo-build-std\" for tier-3 cross-compilation via setup-cross-toolchain-action + nightly + -Z build-std (Linux → tier-3 BSD without prebuilt std); \n- \"vm\" for builds that run inside a target-OS VM (e.g. OpenBSD on a vmactions/openbsd-vm sidecar) and bypass the standard upload-assets matrix.",
          "markdownDescription": "# Build tool  \n- `cargo`, native compilation on a matching runner.  \n- `cross`, cross-compilation via the `cross` crate (Linux → { Linux, *BSD } where cross has a maintained image).  \n- `cargo-cross-toolchain`, cross-compilation via [`taiki-e/setup-cross-toolchain-action`](https://github.com/taiki-e/setup-cross-toolchain-action) on a Linux runner; uses host `cargo` with a real cross C toolchain. For tier-2 BSD/illumos/Android targets where `std` is prebuilt.  \n- `cargo-build-std`, tier-3 cross-compilation: `setup-cross-toolchain-action` + nightly Rust + `-Z build-std`. The release workflow handles the manual build/package/upload because `taiki-e/upload-rust-binary-action` cannot inject `-Z build-std`.  \n- `vm`, built inside a target-OS VM (e.g. OpenBSD via [`vmactions/openbsd-vm`](https://github.com/vmactions/openbsd-vm)). Bypasses the matrix-driven upload-assets job; handled by a dedicated workflow job.",
          "type": "string",
          "enum": [
            "cargo",
            "cross",
            "cargo-cross-toolchain",
            "cargo-build-std",
            "vm"
          ]
        },
        "cpu": {
          "description": "npm \"cpu\" field, values from Node's \"process.arch\".",
          "markdownDescription": "# CPU architecture  \n[npm `cpu` field](https://docs.npmjs.com/cli/v11/configuring-npm/package-json#cpu), values from Node's [`process.arch`](https://nodejs.org/api/process.html#processarch).",
          "type": "array",
          "minItems": 1,
          "uniqueItems": true,
          "items": {
            "type": "string",
            "enum": [
              "arm",
              "arm64",
              "ia32",
              "loong64",
              "mips",
              "mipsel",
              "ppc64",
              "riscv64",
              "s390",
              "s390x",
              "x64"
            ]
          }
        },
        "experimental": {
          "title": "Experimental flag",
          "description": "Used by the release workflow as \"continue-on-error\". \nOnly valid on tier-3 targets.",
          "default": false,
          "type": "boolean"
        },
        "libc": {
          "description": "npm \"libc\" field, only meaningful on Linux. \nDistinguishes glibc and musl builds so the right sub-package is installed on Alpine etc.",
          "markdownDescription": "# libc variant  \n[npm `libc` field](https://docs.npmjs.com/cli/v11/configuring-npm/package-json#libc), only meaningful on Linux.  \nDistinguishes glibc and musl builds so the right sub-package is installed on Alpine etc.",
          "type": "array",
          "minItems": 1,
          "uniqueItems": true,
          "items": {
            "type": "string",
            "enum": [
              "glibc",
              "musl"
            ]
          }
        },
        "os": {
          "description": "npm \"os\" field, values from Node's \"process.platform\". \nnpm uses this to select the correct \"optionalDependency\" at install time.",
          "markdownDescription": "# Operating system  \n[npm `os` field](https://docs.npmjs.com/cli/v11/configuring-npm/package-json#os), values from Node's [`process.platform`](https://nodejs.org/api/process.html#processplatform).  \nUsed to select the correct [`optionalDependency`](https://docs.npmjs.com/cli/v11/configuring-npm/package-json#optionaldependencies) at install time.",
          "type": "array",
          "minItems": 1,
          "uniqueItems": true,
          "items": {
            "type": "string",
            "enum": [
              "aix",
              "android",
              "darwin",
              "freebsd",
              "linux",
              "netbsd",
              "openbsd",
              "sunos",
              "win32"
            ]
          },
          "markdownTitle": "# Operating system"
        },
        "pkg": {
          "description": "Final package name is \"<scope>/<pkg>\".",
          "markdownDescription": "# Sub-package name suffix.  \nFinal package name is `<scope>/<pkg>`.  \n- [NPM Scope](https://docs.npmjs.com/cli/v11/using-npm/scope)\n- [NPM Package name rules](https://docs.npmjs.com/cli/v11/using-npm/package-spec#package-name)\n- [NPM `package.json#name`](https://docs.npmjs.com/cli/v11/configuring-npm/package-json#name)",
          "type": "string",
          "pattern": "^[a-z0-9][a-z0-9-]*$"
        },
        "runner": {
          "description": "Hosted/self-hosted runner labels.",
          "markdownDescription": "# GitHub Actions runner label  \nHosted/self-hosted runner labels.",
          "examples": [
            "ubuntu-latest",
            "macos-latest",
            "macos-15-intel",
            "windows-latest",
            "windows-11-arm"
          ],
          "type": "string",
          "minLength": 1
        },
        "rust": {
          "description": "Passed to \"cargo build --target\" / \"cross build --target\". \nAlso used to locate the release tarball: \"runner-<tag>-<rust>.tar.gz\".",
          "markdownDescription": "# Rust target triple  \nPassed to `cargo build --target` / `cross build --target`.  \nAlso used to locate the release tarball: `runner-<tag>-<rust>.tar.gz`.",
          "type": "string",
          "pattern": "^[a-z0-9_]+(-[a-z0-9_]+){2,3}$"
        },
        "tier": {
          "description": "1 = first-class (release-blocking), \n2 = best-effort, \n3 = experimental (failures don't block release).",
          "markdownDescription": "# Support tier  \n1 = first-class (release-blocking),  \n2 = best-effort,  \n3 = experimental (failures don't block release).",
          "type": "integer",
          "enum": [
            1,
            2,
            3
          ]
        }
      },
      "additionalProperties": false,
      "dependentSchemas": {
        "libc": {
          "description": "libc is only meaningful on Linux. If declared, os must include linux.",
          "required": [
            "os"
          ],
          "properties": {
            "os": {
              "type": "array",
              "contains": {
                "const": "linux"
              }
            }
          }
        }
      },
      "allOf": [
        {
          "if": {
            "required": [
              "os"
            ],
            "properties": {
              "os": {
                "type": "array",
                "contains": {
                  "const": "linux"
                }
              }
            }
          },
          "then": {
            "description": "Linux targets must declare libc to disambiguate glibc and musl builds at install time.",
            "required": [
              "libc"
            ]
          }
        },
        {
          "if": {
            "required": [
              "experimental"
            ],
            "properties": {
              "experimental": {
                "const": true
              }
            }
          },
          "then": {
            "description": "Only tier-3 targets may be marked experimental.",
            "properties": {
              "tier": {
                "const": 3
              }
            }
          }
        }
      ]
    }
  },
  "title": "runner npm targets matrix",
  "description": "Build matrix for the runner-run façade and its per-platform optionalDependencies. Consumed by packaging/npm/scripts/build-packages.ts and the release workflow.",
  "type": "object",
  "required": [
    "binaries",
    "facade",
    "scope",
    "targets"
  ],
  "properties": {
    "$schema": {
      "description": "Pointer to this schema for editor tooling.",
      "examples": [
        "https://github.com/kjanat/runner/blob/master/npm/targets.schema.json",
        "./targets.schema.json"
      ],
      "type": "string"
    },
    "binaries": {
      "description": "Binary names extracted from each release tarball and shipped in every platform sub-package's \"bin/\" directory. \nOn Windows, \".exe\" is appended automatically.",
      "markdownDescription": "# Binary names  \nBinary names extracted from each release tarball and shipped in every platform sub-package's `bin/` directory.  \nOn Windows, `.exe` is appended automatically.",
      "type": "array",
      "minItems": 1,
      "uniqueItems": true,
      "items": {
        "type": "string",
        "pattern": "^[a-zA-Z0-9_-]+$"
      }
    },
    "facade": {
      "description": "npm package name of the façade (the package users install). \nResolves to the correct platform sub-package via \"optionalDependencies\".",
      "markdownDescription": "# Facade package name  \nnpm `package` name of the façade (the package users install). \nResolves to the correct platform sub-package via `optionalDependencies`.",
      "default": "runner-run",
      "examples": [
        "runner-run"
      ],
      "type": "string",
      "minLength": 1
    },
    "scope": {
      "description": "npm scope under which platform sub-packages are published. \nEach sub-package is published as \"<scope>/<pkg>\".",
      "markdownDescription": "# npm scope  \nScope under which platform sub-packages are published.  \nEach sub-package is published as `<scope>/<pkg>`.",
      "default": "@runner-run",
      "examples": [
        "@runner-run"
      ],
      "type": "string",
      "pattern": "^@[a-z0-9][a-z0-9-]*$"
    },
    "targets": {
      "description": "Per-platform build targets. \nOne entry per published sub-package.",
      "markdownDescription": "# Build targets  \nPer-platform build targets. One entry per published sub-package.",
      "type": "array",
      "minItems": 1,
      "items": {
        "$ref": "#/$defs/target"
      }
    }
  },
  "additionalProperties": false
}
